{
  "CullMode": "Back",
  "DepthTestEnable": false,
  "DepthWriteEnable": false,
  "DepthCompareOp": "Less",
  "StencilTestEnable": false,
  "RenderingType": "PostProcessing",
  "ConstantProperties": [
    {
      "Name": "_CheckerColorA",
      "Type": "Vector",
      "Value": "0.99, 0.99, 0.99, 1"
    },
    {
      "Name": "_CheckerColorB",
      "Type": "Vector",
      "Value": "0.75, 0.75, 0.75, 1"
    },
    {
      "Name": "_GridSize",
      "Type": "Scalar",
      "Value": "10"
    },
    {
      "Name": "_Flags",
      "Type": "IntScalar",
      "Value": "-1"
    }
  ],
  "Properties" : [
    {
      "Name": "_Image",
      "Type": "Texture2D",
      "Value": "WHITE"
    }
  ]
}